Category,Message
ham,so its to be poking man everyday that they teach you in canada abi how are you just saying hi
ham,but im really really broke oh no amount is too small even  ltgt 
ham,ltgt  w jetton ave if you forgot
ham,no but you told me you were going before you got drunk
ham,do not b late love mum
ham,cud u tell ppl im gona b a bit l8 cos 2 buses hav gon past cos they were full  im still waitin 4 1 pete x
ham,sorry battery died yeah im here
ham,i come n pick  up come out immediately aft ur lesson
ham,went fast asleep deartake care
ham,okok okthenwhats ur todays plan
ham,hope you are feeling great pls fill me in abiola
ham,i just made some payments so dont have that much sorry would you want it fedex or the other way
ham,im fine hope you are also
ham,studying but ill be free next weekend
ham,squeeeeeze this is christmas hug if u lik my frndshp den hug me back if u get 3 u r cute 6 u r luvd 9 u r so lucky none people hate u
spam,xmas  new years eve tickets are now on sale from the club during the day from 10am till 8pm and on thurs fri  sat night this week theyre selling fast
ham,it could work well reach a consensus at the next meeting
ham,its hard to believe things like this all can say lie but think twice before saying anything to me
ham,im going 4 lunch now wif my family then aft dat i go str 2 orchard lor
ham,unni thank you dear for the rechargerakhesh
ham,gud mrng dear have a nice day
spam,enjoy the jamster videosound gold club with your credits for 2 new videosounds2 logosmusicnews get more fun from jamstercouk 16only help call 09701213186 
ham,hmmm thk sure got time to hop ard ya can go 4 free abt muz call u to discuss liao 
ham,sorry i cant help you on this
ham,you need to get up now
spam,you can donate 250 to unicefs asian tsunami disaster support fund by texting donate to 864233 250 will be added to your next bill
ham,i cant pick the phone right now pls send a message
ham,kkwhy cant you come here and search job
ham,the guy at the car shop who was flirting with me got my phone number from the paperwork and called and texted me im nervous because of course now he may have my address should i call his boss and tell him knowing this may get him fired
spam,thanks for your ringtone order reference number x29 your mobile will be charged 450 should your tone not arrive please call customer services 09065989180
ham,yup ok i go home look at the timings then i msg  again xuhui going to learn on 2nd may too but her lesson is at 8am
ham,maybe westshore or hyde park village the place near my house
ham,oh ok wats ur email
ham,yes obviously but you are the eggspert and the potato head speak soon 
ham,i aint answerin no phone at what is actually a pretty reasonable hour but im sleepy
ham,no current and food here i am alone also
spam,themobhit the link to get a premium pink panther game the new no 1 from sugababes a crazy zebra animation or a badass hoody wallpaperall 4 free
spam,dear uve been invited to xchat this is our final attempt to contact u txt chat to 86688 150pmsgrcvdhgsuite3422landsroww1j6hl ldn 18 yrs
ham,with my sis lor we juz watched italian job
spam,no 1 nokia tone 4 ur mob every week just txt nok to 87021 1st tone free  so get txtin now and tell ur friends 150ptone 16 reply hl 4info
spam,our records indicate u maybe entitled to 5000 pounds in compensation for the accident you had to claim 4 free reply with claim to this msg 2 stop txt stop
ham,greetings me  consider yourself excused
ham,not a lot has happened here feels very quiet beth is at her aunts and charlie is working lots just me and helen in at the mo how have you been 
ham,yar lor actually we quite fast cos da ge slow wat haha
ham,jesus armand really is trying to tell everybody he can find
spam,as a registered subscriber yr draw 4 a 100 gift voucher will b entered on receipt of a correct ans when are the next olympics txt ans to 80062
ham,did you say bold then torch later or one torch and 2bold
spam,last chance 2 claim ur 150 worth of discount voucherstext yes to 85023 nowsavamobmember offers mobile t cs 08717898035 300 sub 16  remove txt x or stop
ham,sent me de webadres for geting salary slip
ham,those ducking chinchillas
ham,skallis wont play in first two odi
ham,pls come quick cant bare this
ham,1 go to write msg 2 put on dictionary mode 3cover the screen with hand 4press  ltgt  5gently remove ur hand its interesting
ham,i dont think so you dont need to be going out that late on a school night especially when the one class you have is the one you missed last wednesday and probably failed a test in on friday
ham,im really sorry i lit your hair on fire
ham,do you still have the grinder
ham,alright i have a new goal now
ham,havent left yet so probably gonna be here til dinner
spam,you are being ripped off get your mobile content from wwwclubmobycom call 08717509990 polytruepixringtonesgames six downloads for only 3
ham,great princess i love giving and receiving oral doggy style is my fave position how about you i enjoy making love  ltgt  times per night 
ham,im done
ham,smile in pleasure smile in pain smile when trouble pours like rain smile when sum1 hurts u smile becoz someone still loves to see u smiling
ham,tunde how are you doing this is just wishing you a great day abiola
ham,nope meanwhile she talk say make i greet you
ham,1 i dont have her number and 2 its gonna be a massive pain in the ass and id rather not get involved if thats possible
ham,later i guess i needa do mcat study too
ham,i wish that i was with you holding you tightly making you see how important you are how much you mean to me  how much i need you  in my life 
ham,thanx 4 sending me home
ham,your dad is back in ph
spam,you 07801543489 are guaranteed the latests nokia phone a 40gb ipod mp3 player or a 500 prize txt wordcollect to no83355 tcllc nyusa 150pmt msgrcvd18
ham,this is my number by vivek
ham,call me when u finish then i come n pick u
spam,mila age23 blonde new in uk i look sex with uk guys if u like fun with me text mtalk to 6986618  30pptxt 1st 5free 150 increments help08718728876
ham,im an actor when i work i work in the evening and sleep late since im unemployed at the moment i always sleep late when youre unemployed every day is saturday
spam,eastenders tv quiz what flower does dot compare herself to d violet e tulip f lily txt d e or f to 84025 now 4 chance 2 win 100 cash wkent150p16
ham,i hope your pee burns tonite
ham,shb b ok lor thanx
ham,huh i cant thk of more oredi how many pages do we have
ham,our prashanthettans mother passed away last night pray for her and family
ham,i enjoy watching and playing football and basketball anything outdoors and you
ham,ltgt  great loxahatchee xmas tree burning update you can totally see stars here
ham,can  send me a copy of da report
ham,sad story of a man  last week was my bday my wife didnt wish me my parents forgot n so did my kids  i went to work even my colleagues did not wish
ham,were done
ham,fun fact although you would think armand would eventually build up a tolerance or some shit considering how much he smokes he gets fucked up in like 2 hits
ham,but im on a diet and i ate 1 too many slices of pizza yesterday ugh im always on a diet
ham,hows that watch resizing
ham, dun need to pick ur gf
ham,just got to  ltgt
ham,dont pack what you can buy at any storelike cereals if you must pack food pack gari or something 9ja that you will miss
ham,when can  come out
ham,k want us to come by now
spam,eerie nokia tones 4u rply tone title to 8007 eg tone dracula to 8007 titles ghost addamsfa munsters exorcist twilight wwwgetzedcouk pobox36504w45wq 150p
ham,are you planning to come chennai
ham,sorry ill call later
ham,shall i ask one thing if you dont mistake me
ham,ya very nice  be ready on thursday
ham,ok i go change also
ham,it is a good thing im now getting the connection to bw
ham,yo do you know anyone  ltgt  or otherwise able to buy liquor our guy flaked and right now if we dont get a hold of somebody its just 4 loko all night
ham,have got  few things to do may be in  pub later
ham,am i that much bad to avoid like this
ham,thats cool how was your day
ham,are you going to wipro interview today
ham,wheres my boytoy i miss you  what happened
ham,wrong phone this phone i answer this one but assume the other is people i dont well
ham,nt yet chikkusimple habbahw abt u
ham,guess he wants alone time we could just show up and watch when they do
ham,hey are you going to quit soon xuhui and i working till end of the month 
ham,fuck babe  i miss you already you know  cant you let me send you some money towards your net  i need you  i want you  i crave you 
ham,it didnt work again oh ok goodnight then ill fix and have it ready by the time you wake up you are very dearly missed have a good night sleep
ham,3 pa but not selected
ham,apps class varaya elaya
ham,all e best 4 ur driving tmr 
spam,dear voucher holder have your next meal on us use the following link on your pc 2 enjoy a 2 4 1 dining experiencehttpwwwvouch4mecometlpdiningasp
ham,hi  where are you were at  and theyre not keen to go out i kind of am but feel i shouldnt so can we go out tomo dont mind do you
ham,u guys never invite me anywhere 
ham,i wont touch you with out your permission
spam,urgent your mobile number  won a 2000 bonus caller prize on 100603 this is the 2nd attempt to reach you call 09066368753 asap box 97n7qp 150ppm
ham,or i go home first lar  wait 4 me lor i put down my stuff first
ham,ok
ham,i will take care of financial problemi will help
ham,im not sure if its still available though
ham,i cant pick the phone right now pls send a message
ham,cool so how come you havent been wined and dined before
ham,i know a few people i can hit up and fuck to the yes
ham,nothing but we jus tot u would ask cos u ba gua but we went mt faber yest yest jus went out already mah so today not going out jus call lor
ham,when did you get to the library
ham,then u drive lor
ham,reading gud habit nan bari hudgi yorge pataistha ertini kano
ham,please protect yourself from ethreats sib never asks for sensitive information like passwordsatmsms pin thru email never share your password with anybody
ham,my mobile numberpls sms ur mail idconvey regards to achanammarakheshqatar
spam,win we have a winner mr t foley won an ipod more exciting prizes soon so keep an eye on ur mobile or visit wwwwin82050couk
ham,yeah wheres your class at
ham,ho ho  big belly laugh see ya tomo
spam,congratulations ur awarded either a yrs supply of cds from virgin records or a mystery gift guaranteed call 09061104283 tscs wwwsmsconet 150pm approx 3mins
ham,god asked what is forgiveness a little child gave lovely reply
ham,i think the other two still need to get cash but we can def be ready by 9
ham,nope im still in the market
spam,ur balance is now 500 ur next question is who sang uptown girl in the 80s  2 answer txt ur answer to 83600 good luck
ham,yup song bro no creative neva test quality he said check review online
spam,dear voucher holder to claim this weeks offer at your pc please go to httpwwwwtlpcouktext tscs apply
ham,hello thanx for taking that call i got a job starts on monday
ham,you will go to walmart ill stay
ham,er mw im filled tuth is aight
ham,ok darlin i supose it was ok i just worry too muchi have to do some film stuff my mate and then have to babysit again but you can call me therexx
ham,ok not sure what time tho as not sure if can get to library before class will try see you at some point have good eve
ham,i tot u outside cos darren say u come shopping of course we nice wat we jus went sim lim look at mp3 player
ham,aiya we discuss later lar pick  up at 4 is it
spam,want the latest video handset 750 anytime any network mins half price line rental reply or call 08000930705 for delivery tomorrow
ham,cool we shall go and see have to go to tip anyway are you at home got something to drop in later so lets go to town tonight maybe mum can take us in
ham,he is there you call and meet him
ham,rajipls do me a favour pls convey my birthday wishes to nimya pls today is her birthday
spam,u have a secret admirer reveal who thinks u r so special call 09065174042 to opt out reply reveal stop 150 per msg recd cust care 07821230901
ham,no my mum went 2 dentist
ham,my sister in law hope you are having a great month just saying hey abiola
ham,babe  how goes that day  what are you doing  where are you  i sip my cappuccino and think of you my love  i send a kiss to you from across the sea
ham,only if you promise your getting out as soon as you can and youll text me in the morning to let me know you made it in ok
ham,sorry ill call later
ham,hey babe far 2 spunout 2 spk at da mo dead 2 da wrld been sleeping on da sofa all day
ham,i am late i will be there at
ham,what you did in  leave
ham, give me some time to walk there
ham,am i that much dirty fellow
ham,i was wondering if it would be okay for you to call uncle john and let him know that things are not the same in nigeria as they r here that  ltgt  dollars is 2years sent and that you know its a strain but i plan to pay back every dime he gives every dime so for me to expect anything from you is not practical something like that
ham,k tell me anything about you
ham,gumbys has a special where a  ltgt  cheese pizza is 2 so i know what were doin tonight
ham,you have registered sinco as payee log in at icicibankcom and enter urn  ltgt  to confirm beware of frauds do not share or disclose urn to anyone
ham,the search 4 happiness is 1 of d main sources of unhappiness accept life the way it comes u will find happiness in every moment u live
ham,i could ask carlos if we could get more if anybody else can chip in
spam,win a 200 shopping spree every week starting now 2 play text store to 88039 skilgme tscs08714740323 1winawk age16 150perweeksub
ham,sorry  was at the grocers
ham,oooh bed ridden ey what are you thinking of
ham,our ride equally uneventful  not too many of those pesky cyclists around at that time of night 
ham,total video converter free download type this in google search
ham,is xy going 4 e lunch
ham,shall i bring us a bottle of wine to keep us amused only joking ill bring one anyway
ham,how stupid to say that i challenge godyou dont think at all on what i write instead you respond immed
ham,please leave this topicsorry for telling that
ham,just hopeing that wasnt too pissed up to remember and has gone off to his sisters or something
ham,ok i only ask abt e movie u wan ktv oso
ham,or ill be a little closer like at the bus stop on the same street
ham,pansy youve been living in a jungle for two years its my driving you should be more worried about
ham,wait thats still not all that clear were you not sure about me being sarcastic or that thats why x doesnt want to live with us
ham,sorry dude dont know how i forgot even after dan reminded me sorry hope you guys had fun
ham,i love to cuddle i want to hold you in my strong arms right now
ham,no she didnt i will search online and let you know
spam,you will recieve your tone within the next 24hrs for terms and conditions please see channel u teletext pg 750
ham,im used to it i just hope my agents dont drop me since ive only booked a few things this year this whole me in boston them in nyc was an experiment
ham,i taught that ranjith sir called me so only i sms like that becaus hes verifying about project prabu told today so only pa dont mistake me
ham,neft transaction with reference number  ltgt  for rs ltdecimalgt  has been credited to the beneficiary account on  ltgt  at  lttimegt  ltgt
spam,cds 4u congratulations ur awarded 500 of cd gift vouchers or 125 gift guaranteed  freeentry 2 100 wkly draw xt music to 87066 tncs wwwldewcom1win150ppmx3age16 
ham,merry christmas to you too babe i love ya kisses
ham,how much you got for cleaning
ham,alex says hes not ok with you not being ok with it
ham,was gr8 to see that message so when r u leaving congrats dear what school and wat r ur plans
ham,cool what time you think you can get here
ham,joys father is john then john is the name of joys father mandan
ham,swhrt how u deyhope ur ok tot about u 2daylove n misstake care
spam,urgent call 09066649731from landline your complimentary 4 ibiza holiday or 10000 cash await collection sae tcs po box 434 sk3 8wp 150ppm 18
ham,i am sorry it hurt you
ham,goodnight da thangam i really miss u dear
ham,he will you guys close
spam,text pass to 69669 to collect your polyphonic ringtones normal gprs charges apply only enjoy your tones
ham,jays getting really impatient and belligerent
ham,ya very nice  be ready on thursday
ham,especially since i talk about boston all up in my personal statement lol i woulda changed that if i had realized it said nyc it says boston now
ham,ok lor anyway i thk we cant get tickets now cos like quite late already u wan 2 go look 4 ur frens a not darren is wif them now
ham,that seems unnecessarily affectionate
ham,ok im not sure what time i finish tomorrow but i wanna spend the evening with you cos that would be vewy vewy lubly love me xxx
ham,im turning off my phone my moms telling everyone i have cancer and my sister wont stop calling it hurts to talk cant put up with it see u when u get home love u
ham,sorry i guess whenever i can get a hold of my connections maybe an hour or two ill text you
ham,when are you going to ride your bike
ham,yeah probably but not sure ilol let u know but personally i wuldnt bother then again if ur goin to then i mite as well
ham,here got ur favorite oyster n got my favorite sashimi ok lar i dun say already wait ur stomach start rumbling
spam,cashbincouk get lots of cash this weekend wwwcashbincouk dear welcome to the weekend we have got our biggest and best ever cash give away these
ham,i know where the  ltgt  is ill be there around 5
ham,i can ask around but theres not a lot in terms of mids up here
ham,tell your friends what you plan to do on valentines day  lturlgt
ham,yes rent is very expensive so its the way we save
spam,summers finally here fancy a chat or flirt with sexy singles in yr area to get matched up just reply summer now free 2 join optout txt stop help08714742804
ham,solve d case  a man was found murdered on  ltdecimalgt  ltgt  afternoon 1his wife called police 2police questioned everyone 3wife siri was sleeping when the murder took place 4cook i was cooking 5gardener i was picking vegetables 6housemaid i went 2 d post office 7children we went 2 play 8neighbour we went 2 a marriage police arrested d murderer immediately whos it reply with reason if u r brilliant
ham,not directly behind abt 4 rows behind 
ham,i know dat feelin had it with pete wuld get with em  nuther place nuther time mayb
ham,don know i didt msg him recently
ham,i want to be there so i can kiss you and feel you next to me
spam,thanks for your ringtone order reference t91 you will be charged gbp 4 per week you can unsubscribe at anytime by calling customer services on 09057039994
ham,they released vday shirts and when u put it on it makes your bottom half naked instead of those white underwear
ham,oooh i got plenty of those
ham,i am great how are you
ham,hello my love how goes that day  i wish your well and fine babe and hope that you find some job prospects i miss you boytoy  a teasing kiss
ham,gods love has no limit gods grace has no measure gods power has no boundaries may u have gods endless blessings always in ur life gud ni8
ham,in case you wake up wondering where i am i forgot i have to take care of something for grandma today should be done before the parade
ham,i have many dependents
ham,got ur mail dileepthank you so muchand look forward to lots of supportvery less contacts hereremember one venugopal you mentionedtomorrow if not latei shall try to come up till theregoodnight dear
ham,thinking of u  x
ham,hi my email address has changed now it is 
ham,photoshop makes my computer shut down
ham,da is good good playerwhy he is unsold
ham,u dun say so early hor u c already then say
ham,ahhhhjust woken uphad a bad dream about u thoso i dont like u right now  i didnt know anything about comedy night but i guess im up for it
ham,blank is blank but wat is blank lol
ham,and several to you sir
ham,thanx yup we coming back on sun finish dinner going back 2 hotel now time flies were tog 4 exactly a mth today hope well haf many more mths to come
ham,thnx dude u guys out 2nite
ham,i want to send something that can sell fast  ltgt k is not easy money
ham,and i dont plan on staying the night but i prolly wont be back til late
ham,as per your request melle melle oru minnaminunginte nurungu vettam has been set as your callertune for all callers press 9 to copy your friends callertune
ham,but i have to i like to have love and arrange
ham,ive reached home finally
spam,important information 4 orange user 0796xxxxxx today is ur lucky day2 find out why log onto httpwwwurawinnercom theres a fantastic prizeawaiting you
ham,got itmail panren paru
spam,tone club your subs has now expired 2 resub reply monoc 4 monos or polyc 4 polys 1 weekly  150p per week txt stop 2 stop this msg free stream 0871212025016
ham,wot is u up 2 then bitch
ham,sounds like there could be a lot of time spent in that chastity device boy  grins  or take your beatings like a good dog going to lounge in a nice long bath now 
ham,u horrible gal u knew dat i was going out wif him yest n u still come n ask me
ham,thanks it was only from tescos but quite nice all gone now speak soon 
ham,ya toldshe was asking wats matter
ham,its ok if anybody asks abt me u tel themp
spam,welcome please reply with your age and gender to begin eg 24m
ham,that means get the door
ham,i dunno they close oredi not  v ma fan
ham,no that just means you have a fat head
ham,still otside leu come 2morrow maga
spam,free2day sexy st georges day pic of jordantxt pic to 89080 dont miss out then every wk a saucy celeb4 more pics c pocketbabecouk 0870241182716 3wk
spam,spook up your mob with a halloween collection of a logo  pic message plus a free eerie tone txt card spook to 8007 zed 08701417012150p per logopic
ham,yo sorry was in the shower sup
spam,you are a winner u have been specially selected 2 receive 1000 cash or a 4 holiday flights inc speak to a live operator 2 claim 0871277810810
ham,sorry about earlier putting out firesare you around to talk after 9 or do you actually have a life lol
ham,hostbased idps for linux systems
ham,why dont you wait til at least wednesday to see if you get your 
spam,hmv bonus special 500 pounds of genuine hmv vouchers to be won just answer 4 easy questions play now send hmv to 86688 more infowww100percentrealcom
spam,i want some cock my hubbys away i need a real man 2 satisfy me txt wife to 89938 for no strings action txt stop 2 end txt rec 150ea otbox 731 la1 7ws 
spam,hi 07734396839 ibh customer loyalty offer the new nokia6600 mobile from only 10 at txtauctiontxt wordstart to no81151  get yours now4t
ham,if india win or level series means this is record
ham,probably gonna swing by in a wee bit
ham,im reaching home in 5 min
ham,umma my life and vava umma love you lot dear
ham,daddy will take good care of you 
spam,check out choose your babe videos  smsshsexnetun fgkslpopw fgkslpo
ham,how do you guys go to see movies on your side
ham,yeah i dont see why not
ham,at 7 we will go ok na
ham,those cocksuckers if it makes you feel better ipads are worthless garbage novelty items and you should feel bad for even wanting one
ham,theres no point hangin on to mr not right if hes not makin u happy
ham,helloooo wake up sweet morning welcomes you enjoy this day with full of joy gud mrng
ham, collecting ur laptop then going to configure da settings izzit
ham,annoying isnt it
ham,easy ahsen got selected means its good
spam,our brand new mobile music service is now live the free music player will arrive shortly just install on your phone to browse content from the top artists
ham,finally it has happened aftr decades beer is now cheaper than petrol the goverment expects us to drink   but dont drive 
ham,good afternoon my boytoy how goes that walking here and there day  did you get that police abstract are you still out and about i wake and miss you babe
ham,just send a text well skype later
ham,yup  not comin 
ham,actually i decided i was too hungry so i havent left yet v
spam,goldviking 29m is inviting you to be his friend reply yes762 or no762 see him wwwsmsacugoldviking stop send stop frnd to 62468
ham,well i was about to give up cos they all said no they didnt do one nighters i persevered and found one but it is very cheap so i apologise in advance it is just somewhere to sleep isnt it
ham,good morning at the repair shopthe only reason im up at this hour
ham,its reassuring in this crazy world
ham,theyre doing it to lots of places only hospitals and medical places are safe
ham,we have sent jd for customer service cum accounts executive to ur mail id for details contact us
ham,oh howda gud gud mathe en samachara chikku
ham,gran onlyfound out afew days agocusoon honi
ham,your gonna be the death if me im gonna leave a note that says its all robs fault avenge me
ham,sweet heart how are you
ham,yeah my usual guys out of town but therere definitely people around i know
ham,ltgt  is fast approaching so wish u a very happy new year happy sankranti happy republic day happy valentines day happy shivratri happy ugadi happy fools day happy may day happy independence day happy friendshipmotherfatherteacherschildrens day amp happy birthday 4 u happy ganesh festival happy dasara happy diwali happy christmas  ltgt  good mornings afternoons evenings nights rememberi am the first to wishing u all theseyours raj
ham,please tell me you have some of that special stock you were talking about
ham,keep my payasam there if rinu brings
ham,i pocked you up there before
ham,remember on that day
ham,am watching house  very entertaining  am getting the whole hugh laurie thing  even with the stick  indeed especially with the stick
ham,ok set let u noe e details later
ham,haha awesome be there in a minute
ham,i love your ass do you enjoy doggy style 
