Category,Message
ham,can dunno wat to get 4 her
ham,haha my friend tyler literally just asked if you could get him a dubsack
ham,you lifted my hopes with the offer of money i am in need especially when the end of the month approaches and it hurts my studying anyways have a gr8 weekend
ham,its good to hear from you
ham,the lay man just to let you know you are missed and thought off do have a great day and if you can send me bimbo and ugos numbers ill appreciate safe
ham,let there be snow let there be snow this kind of weather brings ppl together so friendships can grow
ham,say this slowly godi love you amp i need youclean my heart with your bloodsend this to ten special people amp u c miracle tomorrow do itplspls do it
ham,you could have seen mei didt recognise you face
ham,hey what are you doing y no reply pa
spam,filthy stories and girls waiting for your
ham,why you keeping me away like this
ham,k text me when youre on the way
ham,how many licks does it take to get to the center of a tootsie pop
ham,can you pls send me that company name in saibaba colany
ham,how dare you stupid i wont tell anything to you hear after i wont talk to you
ham,its posible dnt live in  ltgt century cm frwd n thnk different
ham,make that 3 4 fucks sake x
ham,i have a date on sunday with will
ham,yes i think so i am in office but my lap is in room i think thats on for the last few days i didnt shut that down
ham,dnt worryuse ice pieces in a cloth packalso take 2 tablets
ham,dont fret ill buy the ovulation test strips and send them to you you wont get them til like march can you send me your postal addressull be alrightokay
ham,hope things went well at doctors  reminds me i still need 2godid u c d little thing i left in the lounge
ham,at home by the way
ham,tell my  bad character which u dnt lik in me ill try to change in  ltgt  i ll add tat 2 my new year resolution waiting for ur replybe frankgood morning
ham,dude just saw a parked car with its sunroof popped up sux
ham,and do you have any one that can teach me how to ship cars
spam,someone u know has asked our dating service 2 contact you cant guess who call 09058091854 now all will be revealed po box385 m6 6wu
spam,100 dating service call 09064012103 box334sk38ch
ham,i place all ur points on e cultures module already
ham,better made up for friday and stuffed myself like a pig yesterday now i feel bleh but at least its not writhing pain kind of bleh
ham,kind of took it to garage centre part of exhaust needs replacing part ordered n taking it to be fixed tomo morning
ham,say this slowly godi love you amp i need youclean my heart with your bloodsend this to ten special people amp u c miracle tomorrow do itplspls do it
ham,mathews or tait or edwards or anderson
ham,im doing da intro covers energy trends n pros n cons brief description of nuclear fusion n oso brief history of iter n jet got abt 7 n half pages
ham,any chance you might have had with me evaporated as soon as you violated my privacy by stealing my phone number from your employers paperwork not cool at all please do not contact me again or i will report you to your supervisor
ham,true lov n care wil nevr go unrecognized though somone often makes mistakes when valuing it but they will definitly undrstnd once when they start missing it
ham,thats significant but dont worry
spam,hi there 2nights ur lucky night uve been invited 2 xchat the uks wildest chat txt chat to 86688 now 150pmsgrcvdhgsuite3422landsroww1j6hl ldn 18yrs
spam,free video camera phones with half price line rental for 12 mths and 500 cross ntwk mins 100 txts call mobileupd8 08001950382 or call2optout674
ham,text me when you get off dont call my phones having problems
ham,just gettin a bit arty with my collages at the mo well tryin 2 ne way got a roast in a min lovely i shall enjoy that
ham,no shit but i wasnt that surprised so i went and spent the evening with that french guy i met in town here and we fooled around a bit but i didnt let him fuck me
ham,u wake up already wat u doing u picking us up later rite im taking sq825 reaching ard 7 smth 8 like dat u can check e arrival time c ya soon
spam,ur ringtone service has changed 25 free credits go to club4mobilescom to choose content now stop txt club stop to 87070 150pwk club4 po box1146 mk45 2wt
ham,if you have belive me come to my home
ham,ha then we must walk to everywhere cannot take tram my cousin said can walk to vic market from our hotel 
ham,my darling sister how are you doing whens school resuming is there a minimum wait period before you reapply do take care
ham,hi this is yijue its regarding the 3230 textbook its intro to algorithms second edition im selling it for 50
ham,lmao take a pic and send it to me
ham,great how is the office today
ham,lol no i just need to cash in my nitros hurry come on before i crash out
ham,i went to ur hon lab but no one is there
ham,i love you you set my soul on fire it is not just a spark but it is a flame a big rawring flame xoxo
ham,where are you  what are you doing  are yuou working on getting the pc to your moms  did you find a spot that it would work  i need you
spam,do you want a new video handset 750 any time any network mins unlimited text camcorder reply or call now 08000930705 for del sat am
ham,abeg make profit but its a start are you using it to get sponsors for the next event
ham,tadaaaaa i am home babe are you still up 
ham,send me yettys number pls
ham,happy birthday to youdearwith lots of loverakhesh nri
spam,dont b floppy b snappy  happy only gay chat service with photo upload call 08718730666 10pmin 2 stop our texts call 08712460324
spam,this is the 2nd time we have tried to contact u u have won the 1450 prize to claim just call 09053750005 b4 310303 tcsstop sms 08718725756 140ppm
ham,awesome that gonna be soon or later tonight
ham,ive been searching for the right words to thank you for this breather i promise i wont take your help for granted and will fulfil my promise you have been wonderful and a blessing at all times
ham,you getting back any time soon
ham,jane babes not goin 2 wrk feel ill after lst nite foned in already cover 4 me chuck
ham,yes they replied my mail im going to the management office later plus will in to bank later alsoor on wednesday
ham,thanx 4 e brownie its v nice
spam,this is the 2nd time we have tried to contact u u have won the 400 prize 2 claim is easy just call 087104711148 now only 10p per minute btnationalrate
ham,sent me ur email id soon
ham,k if u bored up just come to my home
ham,sir waiting for your letter
ham,yo we are watching a movie on netflix
ham,oh k  i will come tomorrow
ham,alright babe
ham,first answer my question
ham,would me smoking you out help us work through this difficult time
ham,save yourself the stress if the person has a dorm account just send your account details and the money will be sent to you
spam,someone u know has asked our dating service 2 contact you cant guess who call 09058095107 now all will be revealed pobox 7 s3xy 150p 
ham,why she wants to talk to me
ham,i will once i get home
ham,happy new year to u too
ham,we made it eta at taunton is 1230 as planned hope thats still okday good to see you xx
ham,ive got some salt you can rub it in my open wounds if you like
ham,then any special there
spam,congratulations ur awarded 500 of cd vouchers or 125gift guaranteed  free entry 2 100 wkly draw txt music to 87066 tncs wwwldewcom1win150ppmx3age16
ham,hi hope u get this txtjourney hasnt been gdnow about 50 mins late i think
ham,haha mayb ure rite u know me well da feeling of being liked by someone is gd lor u faster go find one then all gals in our group attached liao
ham,u sick still can go shopping
ham,jolly good by the way  will give u tickets for sat eve 730 speak before then x
ham,kkwhere are youhow did you performed
ham,sorry sir i will call you tomorrow  senthilhsbc
ham,chk in ur belovd ms dict
ham,yeah confirmed for you staying at  that weekend
ham,hi chikku send some nice msgs
ham,pls she needs to dat slowly or she will vomit more
ham,aiyo her lesson so early im still sleepin haha okie u go home liao den confirm w me lor
spam,you have won a guaranteed 1000 cash or a 2000 prize to claim yr prize call our customer service representative on 08714712394 between 10am7pm
ham,ive reached sch already
ham,aight lemme know whats up
ham,spending new years with my brother and his family lets plan to meet next week are you ready to be spoiled 
ham,come round its  
ham,great comedycant stop laughing da
ham,yar but they say got some error
ham,pandy joined 4w technologies todayhe got job
ham,yo carlos a few friends are already asking me about you you working at all this weekend
ham,looks like you found something to do other than smoke great job
ham, was a nice day and impressively i was sensible went home early and now feel fine or am i just boring whens yours i cant remember
ham, hows things just a quick question
ham,wen ur lovable bcums angry wid u dnt take it seriously coz being angry is d most childish n true way of showing deep affection care n luv kettoda manda have nice day da
ham,hi happy birthday hi hi hi hi hi hi hi
ham,then ur physics get a
ham,in work now going have in few min
ham,it has issues right now ill fix for her by tomorrow
ham,lmao ok i wont be needing u to do my hair anymore
ham,as i entered my cabin my pa said  happy bday boss  i felt special she askd me 4 lunch after lunch she invited me to her apartment we went there
ham, go home liao ask dad to pick me up at 6
ham,ill see if i can swing by in a bit got some things to take care of here firsg
ham,ahhh work i vaguely remember that what does it feel like lol
ham,wat makes u thk ill fall down but actually i thk im quite prone 2 falls lucky my dad at home i ask him come n fetch me already
ham,u calling me right call my hand phone
ham,joys father is john then john is the  of joys father if u ans ths you hav  ltgt  iq tis s ias question try to answer
ham,why are u up so early
ham,hello my love what are you doing did you get to that interview today are you you happy are you being a good boy do you think of meare you missing me 
ham,it just seems like weird timing that the night that all you and g want is for me to come smoke is the same day as when a shitstorm is attributed to me always coming over and making everyone smoke
ham,y lei
spam,urgent call 09066612661 from landline your complementary 4 tenerife holiday or 10000 cash await collection sae tcs po box 3 wa14 2px 150ppm 18 sender hol offer
ham,oh really did you make it on air whats your talent
spam,moby pub quizwin a 100 high street prize if u know who the new duchess of cornwall will be txt her first name to 82277unsub stop 150 008704050406 sp
ham,even my brother is not like to speak with me they treat me like aids patent
ham,so wats ur opinion abt him and how abt is character
ham,oh ki think most of wi and nz players unsold
ham,messagesome text missing sendername missing number missing sentdate missing missing u a lot thats y everything is missing sent via fullonsmscom
ham,wake me up at  ltgt  am morning
spam,rct thnq adrian for u text rgds vatian
ham,i hope you thats the result of being consistently intelligent and kind start asking him about practicum links and keep your ears open and all the best ttyl
ham,r u sure theyll understand that wine  good idea just had a slurp
ham,yes princess toledo
ham,nothing can
ham,i dont think i can get away for a trek that long with family in town sorry
ham,can you tell shola to please go to college of medicine and visit the academic department tell the academic secretary what the current situation is and ask if she can transfer there she should ask someone to check sagamu for the same thing and lautech its vital she completes her medical education in nigeria its less expensive much less expensive unless she will be getting citizen rates in new zealand
ham,mine here like all fr china then so noisy
ham,hi im always online on yahoo and would like to chat with you someday
ham,you can jot down things you want to remember later
ham,k must book a not huh so going for yoga basic on sunday
ham,glad it went well  come over at 11 then well have plenty of time before claire goes to work
ham,then she buying today  no need to c meh
ham,he didnt see his shadow we get an early spring yay
ham,i am in escape theatre now  going to watch kavalan in a few minutes
ham,i have no idea where you are
ham,sorryin meeting ill call later
ham,had the money issue weigh me down but thanks to you i can breathe easier now ill make sure you dont regret it thanks
ham,yeah do dont stand to close tho youll catch something
ham,nope since ayo travelled he has forgotten his guy
ham,oh mr sheffield you wanna play that game okay youre the boss and im the nanny you give me a raise and ill give you one
ham, said kiss kiss i cant do the sound effects he is a gorgeous man isnt he kind of person who needs a smile to brighten his day 
ham,okay but i thought you were the expert
ham,never try alone to take the weight of a tear that comes out of ur heart and falls through ur eyes always remember a stupid friend is here to share bslvyl
ham,hi wk been ok  on hols now yes on for a bit of a run forgot that i have hairdressers appointment at four so need to get home n shower beforehand does that cause prob for uham
ham,jus chillaxin what up
spam,someone has conacted our dating service and entered your phone because they fancy youto find out who it is call from landline 09111030116 pobox12n146tf15
ham,ugh just got outta class
ham,ok
ham,oh yes ive just been a little under the weather so ive kind of been coccooning at home
spam,urgent your mobile number has been awarded with a 2000 prize guaranteed call 09061790121 from land line claim 3030 valid 12hrs only 150ppm
ham,on hen night going with a swing
ham,ill text now all creepy like so he wont think that we forgot
ham,im already back home so no probably not
ham,jus finish my lunch on my way home lor i tot u dun wan 2 stay in sch today
ham,naughty little thought its better to flirt flirt n flirt rather than loving someone n gettin hurt hurt n hurt gud nyt
ham,today is song dedicated day which song will u dedicate for me send this to all ur valuable frnds but first rply me
ham,hey you got any mail
ham,no i dont have cancer moms making a big deal out of a regular checkup aka pap smear
ham,u too
ham,will it help if we propose going back again tomorrow
ham,carlos says hell be at mu in  ltgt  minutes
ham,hi test on  ltgt rd 
ham,what happen dear tell me
ham,wat makes some people dearer is not just de happiness dat u feel when u meet them but de pain u feel when u miss dem
ham,yo theres no class tmrw right
ham,s daal r above  ltgt
ham,hi di is yijue were meeting at 7 pm at esaplanade tonight
spam,we tried to call you re your reply to our sms for a video mobile 750 mins unlimited text  free camcorder reply of call 08000930705 now
ham,no got new job at bar in airport on satsgettin 447per hour but means no lie in keep in touch
spam,had your mobile 11mths  update for free to oranges latest colour camera mobiles  unlimited weekend calls call mobile upd8 on freefone 08000839402 or 2stoptxt
ham,come back to tampa ffffuuuuuuu
ham,i like dis sweater fr mango but no more my size already so irritating
ham,yeah dont go to bed ill be back before midnight
ham,sorry ive not gone to that place ill do so tomorrow really sorry
spam,december only had your mobile 11mths you are entitled to update to the latest colour camera mobile for free call the mobile update vco free on 08002986906 
ham,i wud never mind if u dont miss me or if u dont need me but u wil really hurt me wen u need me amp u dont tell me take care
ham,yep then is fine 730 or 830 for ice age
ham,rajipls do me a favour pls convey my birthday wishes to nimya pls today is her birthday
spam,bored housewives chat n date now 08717507711 btnational rate 10pmin only from landlines
ham,hiya hows it going in sunny africa hope u r avin a good time give that big old silver back a big kiss from me
spam,urgent we are trying to contact u todays draw shows that you have won a 800 prize guaranteed call 09050001295 from land line claim a21 valid 12hrs only
ham,fuck babe i miss you sooooo much  i wish you were here to sleep with me  my bed is so lonely  i go now to sleep  to dream of you my love 
ham,an amazing quote  sometimes in life its difficult to decide whats wrong a lie that brings a smile or the truth that brings a tear
ham,wot u up 2 thout u were gonna call me txt bak luv k
ham,u say leh of course nothing happen lar not say v romantic jus a bit only lor i thk e nite scenery not so nice leh
ham,we have sent jd for customer service cum accounts executive to ur mail id for details contact us
ham,we confirm eating at esplanade
ham,i actually did for the first time in a while i went to bed not too long after i spoke with you woke up at 7 how was your night
ham,what year and how many miles
ham,not for possession especially not first offense
ham,thats cool princess i will cover your face in hot sticky cum 
ham,hope you are having a good week just checking in
ham,ohi asked for fun hahatake care 
ham,youd like that wouldnt you jerk
ham,its cool but tyler had to take off so were gonna buy for him and drop it off at his place later tonight our total order is a quarter you got enough
ham,tmr then  brin lar aiya later i come n c lar mayb  neva set properly  got da help sheet wif 
ham,how much is blackberry bold2 in nigeria
ham,you are a great role model you are giving so much and i really wish each day for a miracle but god as a reason for everything and i must say i wish i knew why but i dont ive looked up to you since i was young and i still do have a great day
ham,nite
ham,me fineabsolutly fine
ham,good afternoon my love how goes that day  i hope maybe you got some leads on a job i think of you boytoy and send you a passionate kiss from across the sea
ham,quite late lar ard 12 anyway i wun b drivin
ham,lol no u can trust me
ham,what u talking bout early morning its almost noon where your at
ham,pete can you please ring meive hardly gotany credit
ham,now u sound like manky scouse boy stevelike i is travelling on da bus homewot has u inmind 4 recreation dis eve
ham,its not the same here still looking for a job how much do tas earn there
ham,are you willing to go for apps class
ham,thanks ill keep that in mind
ham,let ur heart be ur compass ur mind ur map ur soul ur guide and u will never loose in worldgnun  sent via way2smscom
ham,you will be in the place of that man
ham,man this bus is so so so slow i think youre gonna get there before me
ham,hello my boytoy i made it home and my constant thought is of you my love i hope your having a nice visit but i cant wait till you come home to me kiss
ham,k do i need a login or anything
ham,what he said is not the matter my mind saying some other matter is there
ham,aiyah sorry lor i watch tv watch until i forgot 2 check my phone
ham,tell her i said eat shit
ham,k did you call me just now ah 
ham,it should take about  ltgt  min
ham,try neva mate
ham,dont search love let love find u thats why its called falling in love bcoz u dont force yourself u just fall and u know there is smeone to hold u bslvyl
ham,beautiful tomorrow never comes when it comes its already today in the hunt of beautiful tomorrow dont waste your wonderful today goodmorning
ham,i thought slide is enough
ham,how much are we getting
ham,yup how  noe leh
ham,excellent wish we were together right now
spam,07732584351  rodger burns  msg  we tried to call you re your reply to our sms for a free nokia mobile  free camcorder please call now 08000930705 for delivery tomorrow
ham,i think chennai well settled
spam,please call 08712402578 immediately as there is an urgent message waiting for you
ham,princess is your kitty shaved or natural
ham,nope i just forgot will show next week
spam,how come it takes so little time for a child who is afraid of the dark to become a teenager who wants to stay out all night
ham,wat makes some people dearer is not just de happiness dat u feel when u meet them but de pain u feel when u miss dem
ham,lmao wheres your fish memory when i need it
ham,wow  i love you sooo much you know  i can barely stand it  i wonder how your day goes and if you are well my love  i think of you and miss you
ham,otherwise had part time job natuition
ham,captain vijaykanth is doing comedy in captain tvhe is drunken 
ham,carlosll be here in a minute if you still need to buy
ham,haha awesome i might need to take you up on that what you doin tonight
ham,kkwhat are detail you want to transferacc no enough
ham,please da call me any mistake from my side sorry da pls da goto doctor
spam,loans for any purpose even if you have bad credit tenants welcome call noworriesloanscom on 08717111821
ham,miss ya need ya want ya love ya
ham,men like shorter ladies gaze up into his eyes
ham,good no swimsuit allowed 
spam,youll not rcv any more msgs from the chat svc for free hardcore services text go to 69988 if u get nothing u must age verify with yr network  try again
ham,u dont remember that old commercial
ham,its good well find a way
ham,is ur lecture over
ham,ok then i will come to ur home after half an hour
ham,audrie lousy autocorrect
ham,am going to take bath ill place the key in window
ham,dai what this da can i send my resume to this id
ham,he says hell give me a call when his friends got the money but that hes definitely buying before the end of the week
ham,ok lor
spam,your unique user id is 1172 for removal send stop to 87239 customer services 08708034412
ham,ok give me 5 minutes i think i see her btw youre my alibi you were cutting my hair the whole time
ham,sad story of a man  last week was my bday my wife didnt wish me my parents forgot n so did my kids  i went to work even my colleagues did not wish
ham,im not coming over do whatever you want
ham,sorry ill call later
ham,i dont quite know what to do i still cant get hold of anyone i cud pick you up bout 730pm and we can see if theyre in the pub
ham,how have your little darlings been so far this week need a coffee run tomocant believe its that time of week already 
ham,how abt making some of the pics bigger
spam,please call our customer service representative on freephone 0808 145 4742 between 9am11pm as you have won a guaranteed 1000 cash or 5000 prize
ham,i will come with karnan car please wait till 6pm will directly goto doctor
spam,urgent we are trying to contact u todays draw shows that you have won a 800 prize guaranteed call 09050003091 from land line claim c52 valid12hrs only
spam,1000s flirting now txt girl or bloke  ur name  age eg girl zoe 18 to 8007 to join and get chatting
spam,if you dont your prize will go to another customer tc at wwwtcbiz 18 150pmin polo ltd suite 373 london w1j 6hl please call back if busy 
ham,all boys made fun of me today ok i have no problem i just sent one message just for fun
ham,hicts employee how are you
ham,do you work all this week 
ham,okie
ham,sorry da thangamits my mistake
ham,i am thinking of going down to reg for pract lessons flung my advance haha wat time u going
ham,hope you are not scared
spam,for ur chance to win a 250 cash every wk txt action to 80608 tscs wwwmovietriviatv custcare 08712405022 1x150pwk
ham,can meh thgt some will clash really ah i dun mind i dun seen to have lost any weight gee
ham,good evening how are you
ham,the last thing i ever wanted to do was hurt you and i didnt think it would have youd laugh be embarassed delete the tag and keep going but as far as i knew it wasnt even up the fact that you even felt like i would do it to hurt you shows you really dont know me at all it was messy wednesday but it wasnt bad the problem i have with it is you have the time to clean it but you choose not to you skype you take pictures you sleep you want to go out i dont mind a few things here and there but when you dont make the bed when you throw laundry on top of it when i cant have a friend in the house because im embarassed that theres underwear and bras strewn on the bed pillows on the floor thats something else you used to be good about at least making the bed
ham,oh yeah clearly its my fault
spam,england v macedonia  dont miss the goalsteam news txt ur national team to 87077 eg england to 87077 trywales scotland 4txt120 poboxox36504w45wq 16
spam,win a year supply of cds 4 a store of ur choice worth 500  enter our 100 weekly draw txt music to 87066 tscs wwwldewcomsubs161win150ppmx3
ham,i wont get concentration dear you know you are my mind and everything 
ham,ok then ill let him noe later n ask him call u tmr
ham,kkany special today
ham,sorry ill call later
ham,sorry  i will be able to get to you see you in the morning
ham,as per your request maangalyam alaipayuthe has been set as your callertune for all callers press 9 to copy your friends callertune
ham,when the first strike is a red one the bird  antelope begin toplay in the fieldof selfindependence believe this  the flower of contention will growrandom
ham,im hungry buy smth home
ham,anytime lor
ham,im in a movie call me 4 wat
ham,am on a train back from northampton so im afraid not im staying skyving off today ho ho will be around wednesday though do you fancy the comedy club this week by the way
ham,kgive back my thanks
ham,dont forget who owns you and whos private property you are  and be my good boy always  passionate kiss
ham,ltgt of pple marry with their lovers becz they hav gud undrstndng dat avoids problems i sent dis 2 u u wil get gud news on friday by d person you like and tomorrow will be the best day of your life dont break this chain if you break you will suffer send this to  ltgt  frnds in ltgt  mins whn u read
ham,hi can i please get a  ltgt  dollar loan from you ill pay you back by mid february pls
ham,how are you i miss you
ham,good afternoon loverboy  how goes you day  any luck come your way i think of you sweetie and send my love across the sea to make you smile and happy
ham,in sch but neva mind u eat 1st lor
