Category,Message
spam,married local women looking for discreet action now 5 real matches instantly to your phone text match to 69969 msg cost 150p 2 stop txt stop bcmsfwc1n3xx
spam, free polyphonic ringtone text super to 87131 to get your free poly tone of the week now 16 sn pobox202 nr31 7zs subscription 450pw
ham,can not use foreign stamps in this country good lecture 
ham,convey my regards to him
spam,urgent your mobile number has been awarded with a 2000 prize guaranteed call 09061790126 from land line claim 3030 valid 12hrs only 150ppm
ham,ok i also wan 2 watch e 9 pm show
ham,my sister got placed in birla soft da
spam,hi babe its chloe how r u i was smashed on saturday night it was great how was your weekend u been missing me sp visionsmscom text stop to stop 150ptext
ham,hmmmbut you should give it on one day
ham,hai ana tomarrow am coming on morning  ltdecimalgt  ill be there in sathy then we ll go to rto office reply me after came to home
ham,ha ha ha good joke girls are situation seekers
ham,did u download the fring app
ham,argh my 3g is spotty anyway the only thing i remember from the research we did was that province and sterling were the only problemfree places we looked at
ham,then mums repent how
ham,oh you got many responsibilities
ham,omg you can make a wedding chapel in frontierville why do they get all the good stuff
ham,thanks a lot for your wishes on my birthday thanks you for making my birthday truly memorable
ham,thank you meet you monday
spam,buy space invaders 4 a chance 2 win orig arcade game console press 0 for games arcade std wap charge see o2coukgames 4 terms  settings no purchase
ham,was doing my test earlier i appreciate you will call you tomorrow
spam,talk sexy make new friends or fall in love in the worlds most discreet text dating service just text vip to 83110 and see who you could meet
ham,im e person whos doing e sms survey
spam,no 1 nokia tone 4 ur mob every week just txt nok to 87021 1st tone free  so get txtin now and tell ur friends 150ptone 16 reply hl 4info
ham,early bird any purchases yet
ham,do u knw dis no ltgt 
ham,ill call u 2mrw at ninish with my address that icky american freek wont stop callin me 2 bad jen k eh
ham,k i will sent it again
ham,i wish i dont think its gonna snow that much but it will be more than those flurries we usually get that melt before they hit the ground eek we havent had snow since ltgt before i was even born
ham,2 laptop i noe infra but too slow lar i wan fast one
ham,sorry i din lock my keypad
spam,had your contract mobile 11 mnths latest motorola nokia etc all free double mins  text on orange tariffs text yes for callback no to remove from records
ham,k give me a sec breaking a  ltgt  at cstore
ham,sounds like something that someone testing me would sayy
ham,what happen dear why you silent i am tensed
ham,come by our room at some point so we can iron out the plan for this weekend
ham,ok then u tell me wat time u coming later lor
ham,im on gloucesterroad what are uup to later
ham,yes but can we meet in town cos will go to gep and then home you could text at bus stop and dont worry well have finished by march  ish
ham,fine if thats the way u feel thats the way its gota b
ham,great hope you are using your connections from mode men also cos you can never know why old friends can lead you to today
ham, called dad oredi
ham,haha yeah 2 oz is kind of a shitload
ham,sicomo nolistened2the plaid albumquite gdthe new air1 which is hilariousalso boughtbraindancea compofstuff on aphexs abel
ham,no need to buy lunch for me i eat maggi mee
ham,dunno lei  all decide lor how abt leona oops i tot ben is going n i msg him
ham,i thk 530 lor but dunno can get tickets a not wat u doing now
ham,im home
ham,it has everything to do with the weather keep extra warm its a cold but nothing serious pls lots of vitamin c
ham,good afternoon sexy buns how goes the job search  i wake and you are my first thought as always my love i wish your fine and happy and know i adore you
ham,arr birthday today i wish him to get more oscar
ham,whats nannys address
ham,oh dang i didnt mean o send that to you lol
ham,wen ur lovable bcums angry wid u dnt take it seriously coz being angry is d most childish n true way of showing deep affection care n luv kettoda manda have nice day da
ham,what time you thinkin of goin
ham,yup its at paragon i havent decided whether 2 cut yet hee
ham,im done c  there
ham,wat time r  going to xins hostel
spam,had your mobile 10 mths update to latest orange cameravideo phones for free save s with free textsweekend calls text yes for a callback orno to opt out
ham,wat so late still early mah or we juz go 4 dinner lor aiya i dunno
ham,where at were hungry too
ham,hey there glad u r better now i hear u treated urself to a digi cam is it good we r off at 9pm have a fab new year c u in coupla wks
ham,it wont b until 215 as trying 2 sort house out is that ok
ham,i know but you need to get hotel now i just got my invitation but i had to apologise cali is to sweet for me to come to some english blokes weddin
ham,no nothis is kallis home groundamla home town is durban
ham,i wil be there with in  ltgt  minutes got any space
spam,ur cashbalance is currently 500 pounds  to maximize ur cashin now send go to 86688 only 150pmsg cc 08718720201 hgsuite3422lands roww1j6hl
ham,rofl betta invest in some  anti aging products
ham,cps is causing the outages to conserve energy
spam,recpt 13 you have ordered a ringtone your order is being processed
ham,good friends care for each other close friends understand each other and true friends stay forever beyond words beyond time gud ni8
ham,o turns out i had stereo love on mi phone under the unknown album
ham,hows it feel mr your not my real valentine just my yo valentine even tho u hardly play
ham,hi its kate it was lovely to see you tonight and ill phone you tomorrow i got to sing and a guy gave me his card xxx
ham,hi did u decide wot 2 get 4 his bday if not ill prob jus get him a voucher frm virgin or sumfing 
ham,was the actual exam harder than nbme
ham,pity  was in mood for that soany other suggestions
ham,is ur changes 2 da report big cos ive already made changes 2 da previous report
ham,should i tell my friend not to come round til like  ltgt ish
ham,hey sexy buns what of that day no word from you this morning on ym    i think of you
ham,ooh 4got im gonna start belly dancing in moseley weds 630 if u want 2 join me they have a cafe too 
ham,night sweet sleep well ive just been to see the exorcism of emily rose and may never sleep again hugs and snogs 
ham,your pussy is perfect
ham,this weekend is fine an excuse not to do too much decorating
ham,better than bb if he wont use it his wife will or them doctor
ham,as usualiam fine happy amp doing well
spam,urgent your 4 costa del sol holiday or 5000 await collection call 09050090044 now toclaim sae tc s pobox334 stockport sk38xh cost150pm max10mins
ham,hi shanilrakhesh herethanksi have exchanged the uncut diamond stuffleaving back excellent service by dino and prem
ham,ello babe u ok
spam,collect your valentines weekend to paris inc flight  hotel  200 prize guaranteed text paris to no 69101 wwwrtfsphostingcom
spam,we tried to contact you re your reply to our offer of a video handset 750 anytime any networks mins unlimited text camcorder reply or call 08000930705 now
ham,hey mate hows u honeydid u ave good holiday gimmi de gossx
ham,lol boo i was hoping for a laugh
ham,shall call now dear having food
spam,customer service announcement we recently tried to make a delivery to you but were unable to do so please call 07099833605 to reschedule ref9280114
ham,come to my home for one last time i wont do anything trust me
ham,i like to think theres always the possibility of being in a pub later
ham,so that means you still think of teju
ham,will you come online today night
spam,85233 freeringtonereply real
ham,how do friends help us in problems they give the most stupid suggestion that lands us into another problem and helps us forgt the previous problem
ham,yes i started to send requests to make it but pain came back so im back in bed double coins at the factory too i gotta cash in all my nitros
ham,and smile for me right now as you go and the world will wonder what you are smiling about and think your crazy and keep away from you  grins
ham,call me when ure done
ham,dad went out oredi 
ham,where did u go my phone is gonna die you have to stay in here
ham,me too mark is taking forever to pick up my prescription and the pain is coming back
ham,pick ur fone up now u dumb
ham,huh so slow i tot u reach long ago liao u 2 more days only i 4 more leh
ham,dear good morning now only i am up
ham,not thought bout it  drink in tap  spile at seven  is that pub on gas st off broad st by canal  ok
ham,dunno i juz askin cos i got a card got 20 off 4 a salon called hair sense so i tot its da one  cut ur hair 
ham,well theres not a lot of things happening in lindsay on new years sighs some bars in ptbo and the blue heron has something going
ham,yes it completely in out of formclark also utter waste
ham,fuuuuck i need to stop sleepin sup
ham,hows it going got any exciting karaoke type activities planned im debating whether to play football this eve feeling lazy though
ham,so i could kiss and feel you next to me
spam,rock yr chik get 100s of filthy films xxx pics on yr phone now rply filth to 69669 saristar ltd e14 9yt 08701752560 450p per 5 days stop2 cancel
spam,congratulations youve won youre a winner in our august 1000 prize draw call 09066660100 now prize code 2309
spam,we tried to contact you re our offer of new video phone 750 anytime any network mins half price rental camcorder call 08000930705 or reply for delivery wed
ham,so hows the weather over there
ham,get ready for  ltgt  inches of pleasure
ham,well you told others youd marry them
ham,i have 2 docs appointments next week im tired of them shoving stuff up me ugh why couldnt i have had a normal body
ham,yes now only saw your message
ham,keep yourself safe for me because i need you and i miss you already and i envy everyone that sees you in real life
ham,you said not now no problem when you can let me know
spam,uve bin awarded 50 to play 4 instant cash call 08715203028 to claim every 9th player wins min 50500 optout 08718727870
ham,mmm so yummy babe  nice jolt to the suzy
spam,get a free mobile video player free movie to collect text go to 89105 its free extra films can be ordered ts and cs apply 18 yrs only
ham,no youll just get a headache trying to figure it out u can trust me to do the math i promise o
ham,i am taking you for italian food how about a pretty dress with no panties 
spam,urgent we are trying to contact u todays draw shows that you have won a 800 prize guaranteed call 09050003091 from land line claim c52 valid 12hrs only
spam,urgent important information for 02 user today is your lucky day 2 find out why  log onto httpwwwurawinnercom there is a fantastic surprise awaiting you 
ham,no messageno responcewhat happend
ham,im meeting darren
spam,free messagethanks for using the auction subscription service 18  150pmsgrcvd 2 skip an auction txt out 2 unsubscribe txt stop customercare 08718726270
ham,he said that he had a right giggle when he saw u again you would possibly be the first person2die from nvq but think how much you could for 
ham,thanks again for your reply today when is ur visa coming in and r u still buying the gucci and bags my sister things are not easy uncle john also has his own bills so i really need to think about how to make my own money later sha
ham,im parked next to a mini when are you coming in today do you think
ham,the xmas story is peace the xmas msg is love the xmas miracle is jesus hav a blessed month ahead amp wish u merry xmas
ham,ki will give my kvb acc details
ham,hey very inconvenient for your sis a not huh
ham,i will reach ur home in  ltgt  minutes
ham,oh is it send me the address
ham,120 that call cost which i guess isnt bad miss ya need ya want ya love ya
ham,k my roommate also wants a dubsack and another friend may also want some so plan on bringing extra ill tell you when they know for sure
ham,dont worry though i understand how important it is that i be put in my place with a poorly thought out punishment in the face of the worst thing that has ever happened to me brb gonna go kill myself
ham,a bit of ur smile is my hppnss a drop of ur tear is my sorrow a part of ur heart is my life a heart like mine wil care for u forevr as my goodfriend
ham,if youre thinking of lifting me one then no
ham,when you and derek done with class
ham,aight see you in a bit
ham,hi darlin i finish at 3 do u 1 2 pick me up or meet me text back on this number luv kate xxx
ham,sad story of a man  last week was my bday my wife didnt wish me my parents forgot n so did my kids  i went to work even my colleagues did not wish
ham,sorry de i went to shop
ham,huh but i cant go 2 ur house empty handed right
ham,love that holiday monday feeling even if i have to go to the dentists in an hour
ham,hmmm guess we can go 4 kb n power yoga haha dunno we can tahan power yoga anot thk got lo oso forgot liao
spam,urgent we are trying to contact you last weekends draw shows that you have won a 900 prize guaranteed call 09061701939 claim code s89 valid 12hrs only
ham,you might want to pull out more just in case and just plan on not spending it if you can i dont have much confidence in derek and taylors money management
ham,sad story of a man  last week was my bday my wife didnt wish me my parents forgot n so did my kids  i went to work even my colleagues did not wish as i entered my cabin my pa said  happy bday boss  i felt special she askd me 4 lunch after lunch she invited me to her apartment we went there she said do u mind if i go into the bedroom for a minute   ok i sed in a sexy mood she came out 5 minuts latr wid a caken my wife my parents my kidz my friends n my colleagues all screaming surprise  and i was waiting on the sofa    naked
ham,are you this much buzy
ham,were trying to find a chinese food place around here
ham,hey anyway i have to 
ham,how come guoyang go n tell her then u told her
ham,i dont know ask to my brother nothing problem some thing that just i told 
ham,im on da bus going home
ham,ok
ham,how much is torch in 9ja
ham,the sign of maturity is not when we start saying big things but actually it is when we start understanding small things have a nice evening bslvyl
spam,thanks for your subscription to ringtone uk your mobile will be charged 5month please confirm by replying yes or no if you reply no you will not be charged
ham,yes my reg is  ciao
ham,same to u
ham,hey i will be really pretty late you want to go for the lesson first i will join you im only reaching tp mrt
ham,ofcourse i also upload some songs
ham,havent eaten all day im sitting here staring at this juicy pizza and i cant eat it these meds are ruining my life
ham,japanese proverb if one can do it u too can do it if none can do itu must do it indian version if one can do it let him do it if none can do itleave it and finally kerala version if one can do it stop him doing it if none can do it make a strike against it 
ham,sorry me going home first daddy come fetch  later
ham,thanx
ham,kkfrom tomorrow onwards started ah
ham,where are you call me
ham,no i meant the calculation is the same that  ltgt units at  ltgt  this school is really expensive have you started practicing your accent because its important and have you decided if you are doing 4years of dental school or if youll just do the nmde exam
ham,look at the fuckin time what the fuck you think is up
spam,22 146tf150p
ham,sorry i missed you babe i was up late and slept in i hope you enjoy your driving lesson boytoy i miss you too  teasing kiss
ham,aathiwhere are you dear
spam,six chances to win cash from 100 to 20000 pounds txt csh11 and send to 87575 cost 150pday 6days 16 tsandcs apply reply hl 4 info
ham,boooo you always work just quit
ham,sorry brah just finished the last of my exams what up
ham,tick tick tick  babe
ham,thank you so much when we skyped wit kz and sura we didnt get the pleasure of your company hope you are good weve given you ultimatum oh we are countin down to aburo enjoy this is the message i sent days ago
ham,saw guys and dolls last night with patrick swayze it was great
ham,set a place for me in your heart and not in your mind as the mind easily forgets but the heart will always remember wish you happy valentines day
spam,123 congratulations  in this weeks competition draw u have won the 1450 prize to claim just call 09050002311 b4280703 tcsstop sms 08718727868 over 18 only 150ppm
spam,hello we need some posh birds and chaps to user trial prods for champneys can i put you down i need your address and dob asap ta r
spam,as a registered optin subscriber ur draw 4 100 gift voucher will be entered on receipt of a correct ans to 80062 whats no1 in the bbc charts
ham,how much did ur hdd casing cost
ham,ill call you evening ill some ideas
ham,i wanted to wish you a happy new year and i wanted to talk to you about some legal advice to do with when gary and i split but in person ill make a trip to ptbo for that i hope everything is good with you babe and i love ya 
ham,haha can but im having dinner with my cousin
ham,hey company elama po mudyadhu
spam,freemsg claim ur 250 sms messagestext ok to 84025 nowuse web2mobile 2 ur mates etc join txt250com for 150pwk tc box139 la32wu 16  remove txtx or stop
ham,have you not finished work yet or something
ham,it certainly puts things into perspective when something like this happens
ham,hows my loverboy doing  what does he do that keeps him from coming to his queen hmmm  doesnt he ache to speak to me  miss me desparately 
spam,block breaker now comes in deluxe format with new features and great graphics from tmobile buy for just 5 by replying get bbdeluxe and take the challenge
ham, came to look at the flat seems ok in his 50s  is away alot wiv work got woman coming at 630 too
spam,i am hot n horny and willing i live local to you  text a reply to hear strt back from me 150p per msg netcollex ltdhelpdesk 02085076972 reply stop to end
ham,i promise to take good care of you princess i have to run now please send pics when you get a chance ttyl
ham,aight do you still want to get money
ham,my slave i want you to take 2 or 3 pictures of yourself today in bright light on your cell phone bright light
ham,no no i will check all rooms befor activities
spam,yes the only place in town to meet exciting adult singles is now in the uk txt chat to 86688 now 150pmsg
ham,thanks for yesterday sir you have been wonderful hope you enjoyed the burial mojibiola
ham,did either of you have any ideas do you know of anyplaces doing something
ham,oh baby of the house how come you dont have any new pictures on facebook
ham,hi msg meim in office
ham,will you like to be spoiled 
ham,feb  ltgt  is i love u day send dis to all ur valued frnds evn me if 3 comes back ull gt married d person u luv if u ignore dis u will lose ur luv 4 evr
ham,u r the most beautiful girl ive ever seen u r my baby come and c me in the common room
ham,itll be tough but ill do what i have to
ham,there is no sense in my foot and penis
ham,come to me slave your doing it again  going into your shell and unconsciously avoiding me  you are making me unhappy 
ham,are you up for the challenge i know i am 
ham,no dahe is stupid daalways sending like thisdon believe any of those messagepandy is a mental
ham,prabhaim sorydarealyfrm heart im sory
ham,sorryin meeting ill call later
ham,say this slowly godi love you amp i need youclean my heart with your bloodsend this to ten special people amp u c miracle tomorrow do itplspls do it
ham,thanks for picking up the trash
ham,hidid you asked to waheeda fathima about leave
spam,double mins  double txt  12 price linerental on latest orange bluetooth mobiles call mobileupd8 for the very latest offers 08000839402 or call2optoutlf56
ham,ps u no ur a grown up now right
ham,usually the body takes care of it buy making sure it doesnt progress can we pls continue this talk on saturday
ham,okay name ur price as long as its legal wen can i pick them up y u ave x ams xx
ham,apart from the one i told you about yesterday
ham,ok lor
ham,as per your request melle melle oru minnaminunginte nurungu vettam has been set as your callertune for all callers press 9 to copy your friends callertune
ham,a swt thought nver get tired of doing little things 4 lovable persons cozsomtimes those little things occupy d biggest part in their hearts gud ni8
ham,all day working dayexcept saturday and sunday
ham,damn poor zac doesnt stand a chance
ham,so your telling me i coulda been your real valentine and i wasnt u never pick me for nothing
ham,watever relation u built up in dis world only thing which remains atlast iz lonlines with lotz n lot memories feeling
ham,hi babe its me thanks for coming even though it didnt go that welli just wanted my bed hope to see you soon love and kisses xxx
ham,thanks love but am i doing torch or bold
spam,you ve won your 4 costa del sol holiday or 5000 await collection call 09050090044 now toclaim sae tc s pobox334 stockport sk38xh cost150pm max10mins
ham,have a good evening ttyl
spam,urgent please call 0906346330 your abta complimentary 4 spanish holiday or 10000 cash await collection sae tcs box 47 po19 2ez 150ppm 18
ham,kkwhen will you give treat
ham,its ok i noe ure busy but im really too bored so i msg u i oso dunno wat colour she choose 4 me one
ham,probably earlier than that if the stations where i think it is
ham,somebody set up a website where you can play hold em using eve online spacebucks
ham,then i buy
ham,otherwise had part time job natuition
ham,im in inperialmusic listening2the weirdest track ever byleafcutter johnsounds like insects being molestedsomeone plumbingremixed by evil men on acid
ham,brainless baby dolld vehicle sariyag drive madoke barolla
ham,sorry ill call you  later i am in meeting sir
ham,then why you not responding
ham,pls send me a comprehensive mail about who im paying when and how much
ham,jus finish bathing
ham,aiyar sorry lor forgot 2 tell u
spam,free for 1st week no1 nokia tone 4 ur mob every week just txt nokia to 87077 get txting and tell ur mates zed pobox 36504 w45wq norm150ptone 16
spam,win urgent your mobile number has been awarded with a 2000 prize guaranteed call 09061790121 from land line claim 3030 valid 12hrs only 150ppm 
ham,no go no openings for that room til after thanksgiving without an upcharge
ham,if you mean the website yes
ham,hey what how about your project started aha da
spam,not heard from u4 a while call 4 rude chat private line 01223585334 to cum wan 2c pics of me gettin shagged then text pix to 8552 2end send stop 8552 sam xxx
spam,buy space invaders 4 a chance 2 win orig arcade game console press 0 for games arcade std wap charge see o2coukgames 4 terms  settings no purchase
ham,its normally hot mail com you see
ham,hi darlin i hope you had a nice night i wish i had come cant wait to see you love fran ps i want dirty anal sex and i want a 10 man gang bang
ham,sorry ill call later
ham,although i told u dat im into baig face watches now but i really like e watch u gave cos its fr u thanx 4 everything dat uve done today im touched
ham,nothing smsing u n xy lor sorry lor da guys neva c u in person but they sort of know u lor so u wan 2 meet them xy ask me 2 bring u along 4 our next meeting
ham,watching tv lor
ham,no its not pride im almost  ltgt  years old and shouldnt be takin money from my kid youre not supposed to have to deal with this stuff this is grownup stuffwhy i dont tell you
ham,do you know where my lab goggles went
ham,watch lor i saw a few swatch one i thk quite ok ard 116 but i need 2nd opinion leh
ham,you didnt hear it from me
ham,they finally came to fix the ceiling
spam,sunshine quiz wkly q win a top sony dvd player if u know which country the algarve is in txt ansr to 82277 150 sptyrone
spam,our dating service has been asked 2 contact u by someone shy call 09058091870 now all will be revealed pobox84 m26 3uz 150p
ham,daddy shu shu is looking 4 u u wan me 2 tell him ure not in singapore or wat
ham,trust me even if isnt there its there
ham,wat time  finish
ham,staff of placement training in amrita college
ham,youre gonna have to be way more specific than that
ham,ill post her out l8r in class
ham,zoe it just hit me 2 im fucking shitin myself il defo try my hardest 2 cum 2morow luv u millions lekdog
spam,do you want a new video phone750 anytime any network mins 150 text for only five pounds per week call 08000776320 now or reply for delivery tomorrow
ham,sat right okay thanks 
spam,you have 1 new message please call 08715205273
ham,hi baby im sat on the bloody bus at the mo and i wont be home until about 730 wanna do somethin later call me later ortxt back jess xx
ham,ok
ham,yup leaving right now be back soon
ham,kyou are the only girl waiting in reception ah
ham,is there coming friday is leave for pongaldo you get any news from your work place
ham,ok help me ask if shes working tmr a not
ham,i dont can you send it to me plus hows mode
ham,hi darlin im on helens fone im gonna b up the princes 2 nite please come up tb love kate
ham,i am in your office na
ham,lol yes but it will add some spice to your day
spam,for sale  arsenal dartboard good condition but no doubles or trebles
ham,carry on not disturbing both of you
ham,ok lar joking wif u oni
ham,actually getting ready to leave the house
ham,honestly ive just made a lovely cup of tea and promptly dropped my keys in it and then burnt my fingers getting them out
ham,madamregret disturbancemight receive a reference check from dlf premaricakindly be informedrgdsrakheshkerala
spam,you have won a nokia 7250i this is what you get when you win our free auction to take part send nokia to 86021 now hgsuite3422lands roww1jhl 16
